{
  "version": "1.0",
  "nivel": "graduate",
  "respuestas": 598,
  "catalogo": [
    {
      "pregunta": "Actividades deportivas",
      "donde": "dimensiones.json",
      "tipo": "escala",
      "opciones": [
        "Totalmente satisfecho",
        "Muy satisfecho",
        "Satisfecho",
        "Insatisfecho",
        "Totalmente insatisfecho",
        "No utilizo",
        "No conozco"
      ]
    },
    {
      "pregunta": "Ambientes y salas para estudio",
      "donde": "dimensiones.json",
      "tipo": "escala",
      "opciones": [
        "Totalmente satisfecho",
        "Muy satisfecho",
        "Satisfecho",
        "Insatisfecho",
        "Totalmente insatisfecho",
        "No utilizo",
        "No conozco"
      ]
    },
    {
      "pregunta": "Atención del personal administrativo",
      "donde": "dimensiones.json",
      "tipo": "escala",
      "opciones": [
        "Totalmente satisfecho",
        "Muy satisfecho",
        "Satisfecho",
        "Insatisfecho",
        "Totalmente insatisfecho",
        "No utilizo",
        "No conozco"
      ]
    },
    {
      "pregunta": "Aula virtual",
      "donde": "dimensiones.json",
      "tipo": "escala",
      "opciones": [
        "Totalmente satisfecho",
        "Muy satisfecho",
        "Satisfecho",
        "Insatisfecho",
        "Totalmente insatisfecho",
        "No utilizo",
        "No conozco"
      ]
    },
    {
      "pregunta": "Aulas de clase",
      "donde": "dimensiones.json",
      "tipo": "escala",
      "opciones": [
        "Totalmente satisfecho",
        "Muy satisfecho",
        "Satisfecho",
        "Insatisfecho",
        "Totalmente insatisfecho",
        "No utilizo",
        "No conozco"
      ]
    },
    {
      "pregunta": "Ayuda financiera",
      "donde": "dimensiones.json",
      "tipo": "escala",
      "opciones": [
        "Totalmente satisfecho",
        "Muy satisfecho",
        "Satisfecho",
        "Insatisfecho",
        "Totalmente insatisfecho",
        "No utilizo",
        "No conozco"
      ]
    },
    {
      "pregunta": "Calidad de la enseñanza en la carrera",
      "donde": "dimensiones.json",
      "tipo": "escala",
      "opciones": [
        "Totalmente satisfecho",
        "Muy satisfecho",
        "Satisfecho",
        "Insatisfecho",
        "Totalmente insatisfecho",
        "No utilizo",
        "No conozco"
      ]
    },
    {
      "pregunta": "Calidad de la formación académica",
      "donde": "dimensiones.json",
      "tipo": "escala",
      "opciones": [
        "Totalmente satisfecho",
        "Muy satisfecho",
        "Satisfecho",
        "Insatisfecho",
        "Totalmente insatisfecho",
        "No utilizo",
        "No conozco"
      ]
    },
    {
      "pregunta": "Claridad de los recursos académicos",
      "donde": "dimensiones.json",
      "tipo": "escala",
      "opciones": [
        "Totalmente satisfecho",
        "Muy satisfecho",
        "Satisfecho",
        "Insatisfecho",
        "Totalmente insatisfecho",
        "No utilizo",
        "No conozco"
      ]
    },
    {
      "pregunta": "Compromiso",
      "donde": "dimensiones.json",
      "tipo": "escala",
      "opciones": [
        "Totalmente satisfecho",
        "Muy satisfecho",
        "Satisfecho",
        "Insatisfecho",
        "Totalmente insatisfecho",
        "No utilizo",
        "No conozco"
      ]
    },
    {
      "pregunta": "Condiciones ambientales en laboratorios",
      "donde": "dimensiones.json",
      "tipo": "escala",
      "opciones": [
        "Totalmente satisfecho",
        "Muy satisfecho",
        "Satisfecho",
        "Insatisfecho",
        "Totalmente insatisfecho",
        "No utilizo",
        "No conozco"
      ]
    },
    {
      "pregunta": "Conexión Wi-Fi en el campus",
      "donde": "dimensiones.json",
      "tipo": "escala",
      "opciones": [
        "Totalmente satisfecho",
        "Muy satisfecho",
        "Satisfecho",
        "Insatisfecho",
        "Totalmente insatisfecho",
        "No utilizo",
        "No conozco"
      ]
    },
    {
      "pregunta": "Conocimientos actualizados",
      "donde": "dimensiones.json",
      "tipo": "escala",
      "opciones": [
        "Totalmente satisfecho",
        "Muy satisfecho",
        "Satisfecho",
        "Insatisfecho",
        "Totalmente insatisfecho",
        "No utilizo",
        "No conozco"
      ]
    },
    {
      "pregunta": "Cumplimiento de normas y programas",
      "donde": "dimensiones.json",
      "tipo": "escala",
      "opciones": [
        "Totalmente satisfecho",
        "Muy satisfecho",
        "Satisfecho",
        "Insatisfecho",
        "Totalmente insatisfecho",
        "No utilizo",
        "No conozco"
      ]
    },
    {
      "pregunta": "Cursos del programa y contenidos",
      "donde": "dimensiones.json",
      "tipo": "escala",
      "opciones": [
        "Totalmente satisfecho",
        "Muy satisfecho",
        "Satisfecho",
        "Insatisfecho",
        "Totalmente insatisfecho",
        "No utilizo",
        "No conozco"
      ]
    },
    {
      "pregunta": "Empleabilidad, vinculación y ALUMNI",
      "donde": "dimensiones.json",
      "tipo": "escala",
      "opciones": [
        "Totalmente satisfecho",
        "Muy satisfecho",
        "Satisfecho",
        "Insatisfecho",
        "Totalmente insatisfecho",
        "No utilizo",
        "No conozco"
      ]
    },
    {
      "pregunta": "Equipamiento tecnológico en laboratorios",
      "donde": "dimensiones.json",
      "tipo": "escala",
      "opciones": [
        "Totalmente satisfecho",
        "Muy satisfecho",
        "Satisfecho",
        "Insatisfecho",
        "Totalmente insatisfecho",
        "No utilizo",
        "No conozco"
      ]
    },
    {
      "pregunta": "Evaluación del aprendizaje",
      "donde": "dimensiones.json",
      "tipo": "escala",
      "opciones": [
        "Totalmente satisfecho",
        "Muy satisfecho",
        "Satisfecho",
        "Insatisfecho",
        "Totalmente insatisfecho",
        "No utilizo",
        "No conozco"
      ]
    },
    {
      "pregunta": "Exigencia académica",
      "donde": "dimensiones.json",
      "tipo": "escala",
      "opciones": [
        "Totalmente satisfecho",
        "Muy satisfecho",
        "Satisfecho",
        "Insatisfecho",
        "Totalmente insatisfecho",
        "No utilizo",
        "No conozco"
      ]
    },
    {
      "pregunta": "Habilidades de comunicación",
      "donde": "dimensiones.json",
      "tipo": "escala",
      "opciones": [
        "Totalmente satisfecho",
        "Muy satisfecho",
        "Satisfecho",
        "Insatisfecho",
        "Totalmente insatisfecho",
        "No utilizo",
        "No conozco"
      ]
    },
    {
      "pregunta": "Habilidades para aportar nuevas ideas",
      "donde": "dimensiones.json",
      "tipo": "escala",
      "opciones": [
        "Totalmente satisfecho",
        "Muy satisfecho",
        "Satisfecho",
        "Insatisfecho",
        "Totalmente insatisfecho",
        "No utilizo",
        "No conozco"
      ]
    },
    {
      "pregunta": "Habilidades para trabajar en equipo",
      "donde": "dimensiones.json",
      "tipo": "escala",
      "opciones": [
        "Totalmente satisfecho",
        "Muy satisfecho",
        "Satisfecho",
        "Insatisfecho",
        "Totalmente insatisfecho",
        "No utilizo",
        "No conozco"
      ]
    },
    {
      "pregunta": "Información sobre el récord académico",
      "donde": "dimensiones.json",
      "tipo": "escala",
      "opciones": [
        "Totalmente satisfecho",
        "Muy satisfecho",
        "Satisfecho",
        "Insatisfecho",
        "Totalmente insatisfecho",
        "No utilizo",
        "No conozco"
      ]
    },
    {
      "pregunta": "Intercambio estudiantil",
      "donde": "dimensiones.json",
      "tipo": "escala",
      "opciones": [
        "Totalmente satisfecho",
        "Muy satisfecho",
        "Satisfecho",
        "Insatisfecho",
        "Totalmente insatisfecho",
        "No utilizo",
        "No conozco"
      ]
    },
    {
      "pregunta": "La Universidad de Lima",
      "donde": "csat_carrera.json",
      "tipo": "csat",
      "opciones": [
        "Totalmente satisfecho",
        "Muy satisfecho",
        "Satisfecho",
        "Insatisfecho",
        "Totalmente insatisfecho",
        "No utilizo",
        "No conozco"
      ]
    },
    {
      "pregunta": "La carrera",
      "donde": "dimensiones.json",
      "tipo": "escala",
      "opciones": [
        "Totalmente satisfecho",
        "Muy satisfecho",
        "Satisfecho",
        "Insatisfecho",
        "Totalmente insatisfecho",
        "No utilizo",
        "No conozco"
      ]
    },
    {
      "pregunta": "Material bibliográfico en la biblioteca",
      "donde": "dimensiones.json",
      "tipo": "escala",
      "opciones": [
        "Totalmente satisfecho",
        "Muy satisfecho",
        "Satisfecho",
        "Insatisfecho",
        "Totalmente insatisfecho",
        "No utilizo",
        "No conozco"
      ]
    },
    {
      "pregunta": "Mejora en perspectivas de empleo",
      "donde": "dimensiones.json",
      "tipo": "escala",
      "opciones": [
        "Totalmente satisfecho",
        "Muy satisfecho",
        "Satisfecho",
        "Insatisfecho",
        "Totalmente insatisfecho",
        "No utilizo",
        "No conozco"
      ]
    },
    {
      "pregunta": "Metodologías",
      "donde": "dimensiones.json",
      "tipo": "escala",
      "opciones": [
        "Totalmente satisfecho",
        "Muy satisfecho",
        "Satisfecho",
        "Insatisfecho",
        "Totalmente insatisfecho",
        "No utilizo",
        "No conozco"
      ]
    },
    {
      "pregunta": "Perfil del egreso de la carrera",
      "donde": "dimensiones.json",
      "tipo": "escala",
      "opciones": [
        "Totalmente satisfecho",
        "Muy satisfecho",
        "Satisfecho",
        "Insatisfecho",